{
  "schemaVersion": "candidate-build-plan/1.0.0",
  "compilerVersion": "0.1.0",
  "designRevision": 1,
  "coordinateSpace": "bridge-local-stud-grid",
  "grid": {
    "stud": 1,
    "layer": 1,
    "machineTransformRequired": true
  },
  "paletteId": "signal-structure",
  "placements": [
    {
      "partType": "brick-2x2",
      "structuralMemberId": "foundation:0",
      "sourceMemberId": null,
      "phase": "foundation",
      "role": "foundation",
      "gridPosition": {
        "x": -1,
        "y": 0,
        "z": -6
      },
      "orientation": 0,
      "dimensions": {
        "x": 2,
        "y": 1,
        "z": 2
      },
      "colour": "#475569",
      "material": "ABS-matte",
      "occupiedCells": [
        {
          "x": -1,
          "y": 0,
          "z": -6
        },
        {
          "x": -1,
          "y": 0,
          "z": -5
        },
        {
          "x": 0,
          "y": 0,
          "z": -6
        },
        {
          "x": 0,
          "y": 0,
          "z": -5
        }
      ],
      "dependencies": [],
      "placementId": 1
    },
    {
      "partType": "brick-2x2",
      "structuralMemberId": "foundation:0",
      "sourceMemberId": null,
      "phase": "foundation",
      "role": "foundation",
      "gridPosition": {
        "x": -1,
        "y": 0,
        "z": 6
      },
      "orientation": 0,
      "dimensions": {
        "x": 2,
        "y": 1,
        "z": 2
      },
      "colour": "#475569",
      "material": "ABS-matte",
      "occupiedCells": [
        {
          "x": -1,
          "y": 0,
          "z": 6
        },
        {
          "x": -1,
          "y": 0,
          "z": 7
        },
        {
          "x": 0,
          "y": 0,
          "z": 6
        },
        {
          "x": 0,
          "y": 0,
          "z": 7
        }
      ],
      "dependencies": [],
      "placementId": 2
    },
    {
      "partType": "brick-1x2",
      "structuralMemberId": "foundation:0",
      "sourceMemberId": null,
      "phase": "foundation",
      "role": "foundation",
      "gridPosition": {
        "x": 1,
        "y": 0,
        "z": -6
      },
      "orientation": 90,
      "dimensions": {
        "x": 1,
        "y": 1,
        "z": 2
      },
      "colour": "#475569",
      "material": "ABS-matte",
      "occupiedCells": [
        {
          "x": 1,
          "y": 0,
          "z": -6
        },
        {
          "x": 1,
          "y": 0,
          "z": -5
        }
      ],
      "dependencies": [],
      "placementId": 3
    },
    {
      "partType": "brick-1x2",
      "structuralMemberId": "foundation:0",
      "sourceMemberId": null,
      "phase": "foundation",
      "role": "foundation",
      "gridPosition": {
        "x": 1,
        "y": 0,
        "z": 6
      },
      "orientation": 90,
      "dimensions": {
        "x": 1,
        "y": 1,
        "z": 2
      },
      "colour": "#475569",
      "material": "ABS-matte",
      "occupiedCells": [
        {
          "x": 1,
          "y": 0,
          "z": 6
        },
        {
          "x": 1,
          "y": 0,
          "z": 7
        }
      ],
      "dependencies": [],
      "placementId": 4
    },
    {
      "partType": "brick-2x2",
      "structuralMemberId": "foundation:40",
      "sourceMemberId": null,
      "phase": "foundation",
      "role": "foundation",
      "gridPosition": {
        "x": 39,
        "y": 0,
        "z": -6
      },
      "orientation": 0,
      "dimensions": {
        "x": 2,
        "y": 1,
        "z": 2
      },
      "colour": "#475569",
      "material": "ABS-matte",
      "occupiedCells": [
        {
          "x": 39,
          "y": 0,
          "z": -6
        },
        {
          "x": 39,
          "y": 0,
          "z": -5
        },
        {
          "x": 40,
          "y": 0,
          "z": -6
        },
        {
          "x": 40,
          "y": 0,
          "z": -5
        }
      ],
      "dependencies": [],
      "placementId": 5
    },
    {
      "partType": "brick-2x2",
      "structuralMemberId": "foundation:40",
      "sourceMemberId": null,
      "phase": "foundation",
      "role": "foundation",
      "gridPosition": {
        "x": 39,
        "y": 0,
        "z": 6
      },
      "orientation": 0,
      "dimensions": {
        "x": 2,
        "y": 1,
        "z": 2
      },
      "colour": "#475569",
      "material": "ABS-matte",
      "occupiedCells": [
        {
          "x": 39,
          "y": 0,
          "z": 6
        },
        {
          "x": 39,
          "y": 0,
          "z": 7
        },
        {
          "x": 40,
          "y": 0,
          "z": 6
        },
        {
          "x": 40,
          "y": 0,
          "z": 7
        }
      ],
      "dependencies": [],
      "placementId": 6
    },
    {
      "partType": "brick-1x2",
      "structuralMemberId": "foundation:40",
      "sourceMemberId": null,
      "phase": "foundation",
      "role": "foundation",
      "gridPosition": {
        "x": 41,
        "y": 0,
        "z": -6
      },
      "orientation": 90,
      "dimensions": {
        "x": 1,
        "y": 1,
        "z": 2
      },
      "colour": "#475569",
      "material": "ABS-matte",
      "occupiedCells": [
        {
          "x": 41,
          "y": 0,
          "z": -6
        },
        {
          "x": 41,
          "y": 0,
          "z": -5
        }
      ],
      "dependencies": [],
      "placementId": 7
    },
    {
      "partType": "brick-1x2",
      "structuralMemberId": "foundation:40",
      "sourceMemberId": null,
      "phase": "foundation",
      "role": "foundation",
      "gridPosition": {
        "x": 41,
        "y": 0,
        "z": 6
      },
      "orientation": 90,
      "dimensions": {
        "x": 1,
        "y": 1,
        "z": 2
      },
      "colour": "#475569",
      "material": "ABS-matte",
      "occupiedCells": [
        {
          "x": 41,
          "y": 0,
          "z": 6
        },
        {
          "x": 41,
          "y": 0,
          "z": 7
        }
      ],
      "dependencies": [],
      "placementId": 8
    },
    {
      "partType": "brick-1x2",
      "structuralMemberId": "support:0",
      "sourceMemberId": null,
      "phase": "pier",
      "role": "pier",
      "gridPosition": {
        "x": 0,
        "y": 1,
        "z": -6
      },
      "orientation": 90,
      "dimensions": {
        "x": 1,
        "y": 1,
        "z": 2
      },
      "colour": "#d97706",
      "material": "ABS-matte",
      "occupiedCells": [
        {
          "x": 0,
          "y": 1,
          "z": -6
        },
        {
          "x": 0,
          "y": 1,
          "z": -5
        }
      ],
      "dependencies": [
        1
      ],
      "placementId": 9
    },
    {
      "partType": "brick-1x2",
      "structuralMemberId": "support:0",
      "sourceMemberId": null,
      "phase": "pier",
      "role": "pier",
      "gridPosition": {
        "x": 0,
        "y": 1,
        "z": 6
      },
      "orientation": 90,
      "dimensions": {
        "x": 1,
        "y": 1,
        "z": 2
      },
      "colour": "#d97706",
      "material": "ABS-matte",
      "occupiedCells": [
        {
          "x": 0,
          "y": 1,
          "z": 6
        },
        {
          "x": 0,
          "y": 1,
          "z": 7
        }
      ],
      "dependencies": [
        2
      ],
      "placementId": 10
    },
    {
      "partType": "brick-1x2",
      "structuralMemberId": "support:0",
      "sourceMemberId": null,
      "phase": "pier",
      "role": "pier",
      "gridPosition": {
        "x": 0,
        "y": 2,
        "z": -6
      },
      "orientation": 90,
      "dimensions": {
        "x": 1,
        "y": 1,
        "z": 2
      },
      "colour": "#d97706",
      "material": "ABS-matte",
      "occupiedCells": [
        {
          "x": 0,
          "y": 2,
          "z": -6
        },
        {
          "x": 0,
          "y": 2,
          "z": -5
        }
      ],
      "dependencies": [
        1
      ],
      "placementId": 11
    },
    {
      "partType": "brick-1x2",
      "structuralMemberId": "support:0",
      "sourceMemberId": null,
      "phase": "pier",
      "role": "pier",
      "gridPosition": {
        "x": 0,
        "y": 2,
        "z": 6
      },
      "orientation": 90,
      "dimensions": {
        "x": 1,
        "y": 1,
        "z": 2
      },
      "colour": "#d97706",
      "material": "ABS-matte",
      "occupiedCells": [
        {
          "x": 0,
          "y": 2,
          "z": 6
        },
        {
          "x": 0,
          "y": 2,
          "z": 7
        }
      ],
      "dependencies": [
        2
      ],
      "placementId": 12
    },
    {
      "partType": "brick-1x2",
      "structuralMemberId": "support:0",
      "sourceMemberId": null,
      "phase": "pier",
      "role": "pier",
      "gridPosition": {
        "x": 0,
        "y": 3,
        "z": -6
      },
      "orientation": 90,
      "dimensions": {
        "x": 1,
        "y": 1,
        "z": 2
      },
      "colour": "#d97706",
      "material": "ABS-matte",
      "occupiedCells": [
        {
          "x": 0,
          "y": 3,
          "z": -6
        },
        {
          "x": 0,
          "y": 3,
          "z": -5
        }
      ],
      "dependencies": [
        1
      ],
      "placementId": 13
    },
    {
      "partType": "brick-1x2",
      "structuralMemberId": "support:0",
      "sourceMemberId": null,
      "phase": "pier",
      "role": "pier",
      "gridPosition": {
        "x": 0,
        "y": 3,
        "z": 6
      },
      "orientation": 90,
      "dimensions": {
        "x": 1,
        "y": 1,
        "z": 2
      },
      "colour": "#d97706",
      "material": "ABS-matte",
      "occupiedCells": [
        {
          "x": 0,
          "y": 3,
          "z": 6
        },
        {
          "x": 0,
          "y": 3,
          "z": 7
        }
      ],
      "dependencies": [
        2
      ],
      "placementId": 14
    },
    {